,ID,Type,Name,Cost,Traits,Strength,Health,Restore,Effect,Color
156,154.0,Instant,Locked Shot,"2S
",-,-,-,-,"Play: If you control a ready ""Kalkavat, Iron's Sight"" deal 4 damage to an enemy creature. If you do not, destroy a friendly creature.",Grey
157,155.0,Instant,Badge of Rust,2S,-,-,-,-,Play: Exhaust an enemy creature.,Grey
158,156.0,Instant,Entrench,4S,-,-,-,-,Play: Destroy each creature in the battleline not directly fighting another creature.,Grey
159,157.0,Instant,Disarmor,3S,-,-,-,-,"Play: Stockpile this under a chosen creature. The creature this is stockpiled under loses Subtle, Sturdy and Dauntless.",Grey
160,158.0,Instant,Principle of Decay,3S,-,-,-,-,"Play: Every creature gains ""Deploy: Give this creature -1 | -1 | -1"" until End of Phase.",Grey
161,159.0,Instant,Lurid Sacrifice,3S,-,-,-,-,"Play: Discard your hand. If you discarded 4 or more cards, play the top card of your library at no cost.",Grey
162,160.0,Instant,Touch of the Wastelanders,2S,-,-,-,-,"Play: Flip over the battlefield until the end of phase. Until the end of this phase, the battlefield's effects do not occur, but the battlefield is also uncapturable.",Grey
163,161.0,Instant,"Single Combat
",2S,-,-,-,-,Play: Retreat and exhaust each friendly creature in the Battleline but one and each enemy creature in the Battleline but one. ,Grey
165,162.0,Artifact,Jungle Throne,5G,Location,-,6,-,"Play: Reveal cards from the top of your library until you reveal a creature card. Summon the creature. Shuffle the revealed cards into your library
Action: Heal all damage from target creature",Green
166,163.0,Artifact,Wellspring of Life,"7G
",Location,"-
",17,-,"Play: Give all Beast creatures +1 | +0 | +0
All damage done to friendly creatures is instead done to Wellspring of Life.",Green
167,164.0,Artifact,Faëdir,5G,Location,"-
",5,-,"All friendly creatures gain ""Guard: Heal this creature 2 points.""
Action: Give a creature +0 | +0 | +1",Green
168,165.0,Artifact,Reclaimed Graveyard,7G,Location,-,7,-,"When summoning creatures, you may expend one of the cards in your enemy's discard as a green mana.
Action: Sacrifice a Creature. Gain G mana equal to the cost of that creature.",Green
169,166.0,Artifact,Earth Throne,"7G
",Location,-,5,-,"Play: Heal up to 5 damage from a friendly creature
Action: 1G. Target friendly creature deals damage according to it's toughness until end of turn.",Green
170,167.0,Artifact,Gaerd Village,8G,Location,-,5,-,Action: Gain control of an enemy creature with toughness less than 3 until End of Phase.,Green
171,168.0,Artifact,The True Root,6G,Plant | Wonder,-,8,-,"Play: Fully heal all allied creatures.
Action: Ready a deployed creature.",Green
172,169.0,Artifact,Gaiec Salve,5G,Item | Wonder,-,5,-,"Action: Fully heal a friendly creature
Creatures can't heal friendly artifacts
Creatures you control get +0| +0| +1",Green
173,170.0,Artifact,"Kayl, Wood's Memory",7G,Location,-,2,-,"End of Phase: If any creature has taken damage while defending Kayl, Wood's Memory, fully heal that creature. If a battlefield was captured this phase, you may reveal 2 battlefields from the top of your battlefield deck. If you do, place one of those battlefields into play.",Green
174,171.0,Artifact,Beast's Den,4G,Location,-,7,-,"While Beast's Den is in play, friendly Beasts gain ""Guard: Fully heal this creature."" 
Action: If you control a ready Beast provoke an enemy creature to the battleline.",Green
175,172.0,Creature,Jungle Tiger,2G,Beast,3,2,0,,Green
176,173.0,Creature,"Kastivetz, Protector",4G,Plant | Ancient,1,8,1,"Any time a friendly creature would take damage, deal that damage to Kastivetz, Protector instead.",Green
177,174.0,Creature,Tangle Witch,2G,Human,0,1,3,,Green
178,175.0,Creature,King,4G,Beast,1,3,1,Bloodied: Give this creature +2 | +2 | +0,Green
179,176.0,Creature,Den Mother,4G,Beast,1,3,1,Idle: Heal 1 from all other friendly creatures in this zone.,Green
180,177.0,Creature,Tall Steve,3G,Titan,*,*,0,Tall Steve's Power and Health are equal to the cost of the friendly creature with the highest cost ,Green
181,178.0,Creature,Earth Spirit,9G,Elemental,3,11,3,Guard: Enemy creatures in this zone gain -2 | +0 | +0 until End of Phase.,Green
182,179.0,Creature,Air Spirit,"5G
",Elemental,5,3,0,Deploy: Deploy two other friendly creatures to the same zone as the Air Spirit. Air Spirit and the creature it deploys ignore trap effects.,Green
183,180.0,Creature,Fire Spirit,7G,Elemental,5,1,0,Play: Fire Spirit does 2 damage to each artifact in play,Green
184,181.0,Creature,Water Spirit,9G,Elemental,3,2,3,"Idle: Give Water Spirit +0 | +2 | +0. If The Water Spirit's toughness is at least 7, instead destroy all creatures in play.",Green
185,182.0,Creature,Quilaphant,3G,Beast,1,5,0,Action: 1G. Choose a creature. Deal 2 damage to that creature and 1 damage to Quilaphant.,Green
186,183.0,Creature,Stubborn Weed,2G,Plant,0,1,0,"Destroyed: Instead of destroying Stubborn Weed, fully heal it, exhaust it, and return it to the barracks. If you do, give Stubborn Weed +1 | +1 | +0",Green
187,184.0,Creature,Vineyard Shaman,6G,Human | Plant,2,6,1,Bloodied: Exhaust each creature in this zone.,Green
188,185.0,Creature,"Yllioc, Salvaged Castaway",4G,Construct | Plant,2,2,0,Idle: Ready and heal another Plant creature.,Green
189,186.0,Creature,Valloch Nymph,2G,Beast | Elemental,0,3,0,Idle: Fully heal an allied Elemental creature.,Green
190,187.0,Creature,Towering Behemoth,4G,Beast,0,8,0,"Sentry.
This creature cannot be deployed past the battlefield zone.",
191,188.0,Creature,Swampit,3G,Beast,0,2,1,"Bloodied: You may stockpile a friendly creature recycled this turn under Swampit. If you do, give Swampit +1 | +2 | +0",Green
192,189.0,Creature,Enraged Protector,5G,Beast | Warden,2,7,1,"End of Phase: If a battlefield was captured this turn,  Enraged Protector gains Dauntless and +3| +0 | +0 until the end of the next phase.",Green
193,190.0,Creature,Deepwood Folk,2G,Faerie,1,1,0,"Trap: If the trapped creature has a toughness smaller than 3, return it to its barracks.",Green
194,191.0,Creature,"Ba'a Embi, Treespeaker",5G,Human | Beast,2,5,1,"End of Phase: Search your library for a Plant creature, then place it in your hand. Shuffle your library",Green
195,192.0,Creature,Watcher,3G,Ancient,0,6,0,"End of Phase: Deal 2 damage to this creature. Search your library for a ""Living History"" and place it in your hand.",Green
196,193.0,Creature,Tiriri Flock,1G,Beast,2,1,1,"For each Tiriri Flock in play, Tiri Flock gains +0 | + 2 | + 0.",Green
197,194.0,Creature,Corpse Flower,4G,Beast | Plant,2,4,4,"Trap: The trapped creature gains ""Destroyed: Your opponent gains 2G mana."" until End of Phase. ",Green
198,195.0,Creature,"I'di I'di, Conjurer",6G,Human | Plant,3,5,2,"Whenever I'di I'di destroys an enemy creature, search your deck for a Conjuration and place it in your hand. Shuffle your library.",Green
199,196.0,Instant,Terra Forming,3G,-,-,-,-,Play: Select a battlefield in your battlefield deck. Replace the current battlefield with that battlefield.,Green
200,197.0,Instant,Living History,3G,-,-,-,-,"Play: Your opponent must reveal random card in their hand. If you control a ""Watcher,"" they must discard the card they revealed.",Green
201,198.0,Instant,Natural Vigor,2G,-,-,-,-,"Play: This creature gains ""Deploy: Ready this creature."" until end of phase.",Green
202,199.0,Instant,Cult of the Mammoth,3G,-,-,-,-,Play: Choose a friendly creature. Reduce its power to 0 and give it +0 | +8 | +1,Green
203,200.0,Instant,Voice of Land,2G,Conjuration,-,-,-,"Play: Heal an allied creature up to 3 points. If you heal more than 2 points with this card, gain 2 standing green mana until end of phase.",Green
204,201.0,Instant,Voice of Flame,1G,Conjuration,-,-,-,"Play: Deal 2 damage to a creature. If this destroys that creature, deal 1 damage to 2 other creatures.",Green
205,202.0,Instant,Voice of Flight,3G,Conjuration,-,-,-,Play: Ready an allied creature.,Green
206,203.0,Instant,Voice of Tempest,3G,Conjuration,-,-,-,"Play: Shuffle 2 allied creatures back into your deck. If you do, shuffle 3 enemy creatures back into their owner's deck.",Green
207,204.0,Instant,Voice of Void,7G,Conjuration,-,-,-,Play: Destroy each undamaged creature.,Green
208,205.0,Instant,Bearheart,2G,-,-,-,-,Play: Give a creature +0 | + 3 | + 3,Green
209,206.0,Instant,Overgrowth,2G,-,-,-,-,Play: Exhaust a creature in your enemies Barracks.,Green
210,207.0,Instant,Cult of the Quill,2G,-,-,-,-,"Play: Stockpile this card under a creature. This creature gains ""Action: 1G. Choose a creature. Deal 2 damage to that creature and 1 damage to this creature""",Green
211,208.0,Instant,Intimidation,2G,-,-,-,-,"Play: If you have a creature of toughness 3 or greater in play, return an enemy creature to its owner's hand.",Green
212,209.0,Instant,Thin the Gap,4G,-,-,-,-,"Play: Give an enemy creature ""End of Phase: Destroy this creature."" until end of phase.",Green
213,210.0,Instant,Lean Winter,3G,-,-,-,-,Play: Each ready creature gains + 0 | - 2 | + 0.,Green
214,211.0,Instant,Hibernate,2G,-, ,-,-,Play: You may exhaust up to three friendly creatures. Fully heal those creatures.,Green
215,212.0,Instant,Cost of Power,3G,-,-,-,-,Play: Choose a creature. That creature deals damage to itself equal to its power.,Green
216,213.0,Instant,Faerie Song,2G,-,-,-,-,Play: Exhaust 2 enemy creatures.,Green
218,214.0,Artifact,"Rignafen, Venturing Citadel",6B,Location | Ship,-,13,-,"Action: 1B -  Rignafen is deployed to your Barracks as a 4 | 9 | 0 and can be used as a creature.
Creatures that die defending Rignafen are worth 2B in discard during the next phase.",Blue
219,215.0,Artifact,Battered Colossus,7B,Location,-,7,-,"Bloodied: Shuffle half your enemy's Discard back into their Deck.
Pillager creatures gain +1 | +1 | +0",Blue
220,216.0,Artifact,"Aksÿva, Sea Spire",6B,Location | Ancient,-,5,-,"Action: 1B. For each two creatures in your discard, deal 1 damage to an enemy creature of your choice.",Blue
221,217.0,Artifact,Essence of the Bjïrkir,6B,Item | Wonder,-,4,-,"Action: 1B. Give an allied creature +2 | +0 | +0 until the end of the phase. At the end of the phase, deal 2 damage to that creature.
When a Martyr creature is destroyed, give Essence of the Bjïrkir +0 | +1 | +0.",Blue
222,218.0,Artifact,Frigid Altar,5B,Location,-,9,-,Action: Sacrifice a friendly creature in the Battleline. If you do return two enemy creatures to their Barracks and tap them.,Blue
223,219.0,Artifact,Favored Waters,4B,Location,-,2,-,"When an enemy captures a battlefield, they must sacrifice a creature",Blue
224,220.0,Artifact,Kvolmer,5B,Item | Wonder,-,3,-,"Start of Phase: If Kvolmer has 3 or more counters on it, sacrifice Kvolmer and summon three Horror creatures from your discard at no cost. 
Action: Place a counter on Kvolmer.",Blue
225,221.0,Artifact,Serpent's Halberd,7B,Item | Horror,-,7,-,"Recycled: Deal 2 damage to a friendly creature.
Play: Each creature gains +2|+2|+0 for each point of damage they have sustained.",Blue
226,222.0,Artifact,Voyager's Chant,5B,Ritual,-,6,-,"Each time a friendly martyr creature is destroyed, you may stockpile it under Voyager's Chant instead of discarding it.
Action: Discard one of the cards under Voyager's Chant. If you do, then draw cards equal to the number of cards under Voyager's Chant.",Blue
227,223.0,Artifact,Crimson Glyphs,7B,Item | Ritual,-,4,-,"Action: You may stockpile a friendly creature under Crimson Glyphs. If you do, deal damage equal to that creature's power to a creature.
Bloodied: You may sacrifice a friendly creature. If you do, summon each creature under Crimson Glyph's at no cost.",Blue
228,224.0,Creature,Seasoned Marauder,2B,Pillager,1,3,0,Bloodied: Seasoned Marauder gains +1 | +1 | +0,Blue
229,225.0,Creature,"Vïlaac, Protector",4B,Pillager,2,5,3,"Bloodied: Fully heal an allied creature.
Revealed: Your opponent sacrifices a creature.",Blue
230,226.0,Creature,Desperate Finale,8B,Horror,*,3,1,"Play: Stockpile each creature in your discard under this creature. Desperate Finale's power is equal to the number of creatures stockpiled under it.
Sturdy (This creature does not take damage, unless that damage would be enough to destroy it)",Blue
231,227.0,Creature,Corpse-Eater,3B,Horror,5,2,0,"Sturdy (This creature does not take damage, unless that damage would be enough to destroy it) 
Whenever Corpse-Eater destroys a creature, stockpile it under this creature.",Blue
232,228.0,Creature,Battering Party,3B,Pillager,2,3,1,Deploy: Deal 1 damage to every creature in the zone where this is deployed.,Blue
233,229.0,Creature,Shield Urchin,3B,Beast,0,5,2,Bloodied: Shield Urchin deals 1 damage to every creature in the zone where this is deployed,Blue
234,230.0,Creature,Valhallan Martyr,-,"Pillager | Martyr
",2,1,0,"Recycled: You may deal 2 damage to an allied non-martyr creature. If you do, summon Valhallan Martyr",Blue
235,231.0,Creature,Keeper of Stories,2B,Human | Scholar,1,1,0,Discarded: Idle an allied creature and draw a card.,Blue
236,232.0,Creature,Sheepskin Traitor,3B,Pillager,3,2,0,Subtle (This creature may ignore the battleline when deploying),Blue
237,233.0,Creature,"Yria, Spear Maiden",5B,Apparition | Martyr,5,3,1,Deploy: Deal 2 damage to a creature in the zone this creature is deployed to.,Blue
238,234.0,Creature,"Lopha, Inheritor",5B,Pillager,1,2,1,Idle: Lopha's effects are replaced with the effect of a creature in your discard.,Blue
239,235.0,Creature,"Wylla, Brine Chosen",6B,Pillager,1,4,1,"Deploy: Give each Pillager in this zone ""Destroyed: Deal 1 damage to each creature in this zone"" Until end of phase.",Blue
240,236.0,Creature,Oldrasen,1B,Beast,4,1,0,"Oldrasen comes in ready.
End of Phase: Sacrifice this creature.",Blue
241,237.0,Creature,Kraken,"6B
",Titan | Beast,2,4,1,"Action: 1B. Destroy a creature of toughness lower than Kraken's toughness. If you do, give the Kraken + 0 | +1 | +0",Blue
242,238.0,Creature,Draguk Shambler,4B,Pillager | Horror,X,3,2,Draguk Shambler's base power is equal to half the number of cards in your discard pile.,Blue
243,239.0,Creature,Maré,4B,Beast | Horror,0,2,1,"Destroyed: Stockpile the Maré under an enemy creature. That creature gains ""Destroyed: Shuffle your discard back into your library.""",Blue
244,240.0,Creature,Katek Shaman,4B,Horror,1,1,1,"Idle: You may stockpile a card from your discard under a friendly creature. If you do, give that creature Sturdy until end of turn.",Blue
245,241.0,Creature,Craven Commander,3B,Pillager,1,4,2,"If there is another allied creature in this zone, Craven Commander has Sentry and ""Trap: Deal 2 damage to the trapped creature.""",
246,242.0,Creature,"Rav, The Unfelled",5B,Pillager | Horror,4,1,0,"Destroyed: If Rav is the only friendly creature in this zone, resummon it in the barracks at no cost.",Blue
247,243.0,Creature,"Allya, Mapmaker",4B,Human | Scholar,1,2,1,Action: Ready a friendly Wonder.,Blue
248,244.0,Creature,"Iui, Spirit of the Wreck",5B,Scrap | Horror,2,4,2,"Bloodied: Shuffle a number of cards equal to the damage on Iui from your enemy's discard back into their deck, ",Blue
249,245.0,Creature,Connoiseur of Rage,3B,Pillager,2,4,1,Bloodied: Ready Connoiseur of Rage.,Blue
250,246.0,Creature,Nighthunter,2B,Beast,2,2,0,Trap: Deal 2 damage to the trapped creature.,Blue
251,247.0,Creature,Dauntless Marauder,4B,Pillager,3,2,1,"Destroyed: Deal 3 damage to an enemy creature and 3 damage to an enemy artifact.
Trap: Destroy Dauntless Marauder. Gain 1 mana.",Blue
252,248.0,Creature,Leviathan Crew,3B,Pillager | Ship,3,2,1,Leviathan crew deals double damage to creatures with toughness greater than or equal to 5,Blue
253,249.0,Creature,Eye of the Storm,5B,Elemental | Horror,0,5,0,"Trap: Deal one damage to each creature in this zone.
Sturdy (This creature does not take damage, unless that damage would be enough to destroy it)",Blue
254,250.0,Creature,"Sekir, Captain of the Leviathan",5B,Pillager | Leader,4,3,0,"Sekir deals double damage to creatures with toughness greater than or equal to 5.  
Sturdy (This creature does not take damage, unless that damage would be enough to destroy it.)",Blue
255,251.0,Creature,Ragtooth,4B,Pillager,1,4,3,"Dauntless
While this creature has exactly 3 damage on it, cards with the trait Horror cost 1 less to summon.",Blue
256,252.0,Instant,Horrifying Visions,2B,-,-,-,-,"Play: Exhaust a friendly Horror. If you do, exhaust 2 enemy creatures and deal 2 damage to them.",Blue
257,253.0,Instant,Spearfishing,2B,-,-,-,-,"Play: Choose an enemy creature and an allied creature. Move the enemy creature to the same zone as the allied creature, and deal 2 damage to it.",Blue
258,254.0,Instant,Roughhousing,1B,-,-,-,-,Play: Do 1 damage to a creature. Then give it +1|+1|+0.,Blue
259,255.0,Instant,Burn the Remains,3B,-,-,-,-,Play: Enemy creatures destroyed this turn are placed at the bottom of their owner's deck.,Blue
260,256.0,Instant,Bloodrush,2B,-,-,-,-,"Play: An allied creature gains ""Destroyed: Resummon this creature to your barracks and give it +1 | +0 | +0"" until the end of phase.",Blue
261,257.0,Instant,Burning Path,3B,-,-,-,-,"Play: Sacrifice a creature in the Battleline. If you do, replace the current Battlefield with the next Battlefield",Blue
262,258.0,Instant,Gift of the Blood,"2B
",-,-,-,-,"Play: Give a creature +2 | +0 | +0 and ""End of Phase: If this creature is not in the Battleline, sacrifice it.""",Blue
263,259.0,Instant,Skylight Ceremony,2B,-,-,-,-,"Play: If a friendly creature has died this turn, deal 4 damage to an enemy creature.",Blue
264,260.0,Instant,Raiding Party,2B,-,-,-,-,Play: Deal 1 damage to an artifact for each ready friendly creature you control.,Blue
265,261.0,Instant,Symbiosis,2B,-,-,-,-,"Play: Sacrifice up to three friendly Pillager creatures. For each Pillager creature you sacrifice, give a friendly Horror +1| +1| +0",Blue
266,262.0,Instant,Hunger of the Deep,6B,-,-,-,-,"Play: Give each creature ""End of Phase: Sacrifice this creature.""",Blue
267,263.0,Instant,Stretch Thin,4B,-,-,-,-,"Play: Deal 1 damage to each creature with Sentry, then move them to the barracks and exhaust them.",
268,264.0,Instant,Bloodforged,2B,-,-,-,-,"Play: Sacrifice any number of friendly creatures. For each sacrifice creature, give a friendly creature +1 | +0 | +0.",Blue
269,265.0,Instant,Friendly Winds,3B,-,-,-,-,"Play: Deploy all friendly creatures to the Battleline. Resolve combat in the Battleline, but do not end the phase.",Blue
271,266.0,Battlefield,Valhalla,Location,-,-,-,-,"If a creature would be deployed, deploy it to the battlefield",Brown
272,267.0,Battlefield,Burning Crags,Location,"-
",-,-,-,"Any time a creature is deployed, deal 1 damage to it.",Brown
273,268.0,Battlefield,New Cambria,Location,-,-,-,-,Creatures with power 2 or less gain +1 | +1 | +1. Creatures with power 4 or greater gain -1 | -1 | -1,Brown
274,269.0,Battlefield,Hyperbolic Fields,Location,-,-,-,-,Summoned creatures come in ready.,Brown
275,270.0,Battlefield,River Morphea,Location,-,-,-,-,Creatures trigger Idle effects when deployed to the battlefield.,Brown
276,271.0,Battlefield,Scr4P-T0wN,Location,-,-,-,-,"Each player may discard up to six cards at the beggining of phase, rather than 3.",Brown
277,272.0,Battlefield,Irradiated Waste,Location,-,-,-,-,End of Phase: Each player sacrifices a creature.,Brown
278,273.0,Battlefield,New Moon,State,-,-,-,-,"All creatures gain ""Subtle (This creature may ignore the battleline when being deployed).""",Brown
279,274.0,Battlefield,Watering Hole,Location,-,-,-,-,"Whenever a creature would be deployed, flip a coin. If the coin is heads, deploy it to the intended zone. Otherwise, idle it.",Brown
280,275.0,Battlefield,Plot of Champions,"Location
",-,-,-,-,"Whenever a friendly creature is destroyed, give a friendly creature + 1| + 1| + 0",Brown
281,276.0,Battlefield,"Yol, Stomping Ground",Location,-,-,-,-,"Start of Phase: Each player who controls 2 or more creatures sacrifices their creature with least toughness, then gives their creature with greatest toughness +1 | +0 | +0.",Brown
282,277.0,Battlefield,Crashed Meteor,Location,-,-,-,-,"Revealed: Each Player discards every card in their hand, then draws 6.",Brown
283,278.0,Battlefield,Glowing Cavern,Location,-,-,-,-,End of Phase: Fully heal all creatures.,Brown
284,279.0,Battlefield,Abandoned Battleground,Location,-,-,-,-,"Horror, Apparition, and Scrap creatures gain +1 | +1 | +0 while this is in play.",Brown
285,280.0,Battlefield,Focus,State,-,-,-,-,Each player may only play one card this turn,Brown
286,281.0,Battlefield,Clarity,State,-,-,-,-,Each player may only discard one card this turn,Brown
287,282.0,Battlefield,Aural Plane,Location,-,-,-,-,"Any damage done to artifacts is divided evenly amongst artifacts in play, rounding up",Brown
288,283.0,Battlefield,Haste,State,-,-,-,-,The first creature each player summons this phase comes in ready.,Brown
289,284.0,Battlefield,Colisa Invictum,Location,-,-,-,-,"Each time a creature you control is destroyed, deal 3 damage to a friendly creature.",Brown
290,285.0,Battlefield,Unease,State,-,-,-,-,Start of Phase: Each player reveals a random card in their hand. If a player plays the card they revealed that card's play effect doubles and each opponent must discard the card they revealed.,Brown
291,286.0,Battlefield,Primordial Garden,Location,-,-,-,-,Each creature takes 1 less damage from all sources.,Brown
292,287.0,Battlefield,The Gate,Location,-,-,-,-,Revealed: Destroy each creature.,Brown
293,288.0,Battlefield,The Altar,Location,-,-,-,-,"Whenever a player summons a creature, they must sacrifice another friendly creature.",Brown
294,289.0,Battlefield,Correcting Facility,Location,-,-,-,-,End of Phase: Destroy each damaged creature.,Brown
295,290.0,Battlefield,Volcanic Archipelago,Location,-,-,-,-,Revealed: Each Player shuffles their discard back into their deck. You may discard as many cards as you want this phase.,Brown
296,291.0,Battlefield,Remote Temple,Location,-,-,-,-,"Creatures may not be deployed to this battlefield. Each creature gains ""Action: Sacrifice this creature."" 
End of Phase: The player that has sacrificed the most creatures this phase captures this Battlefield.",Brown
297,292.0,Battlefield,Common Ground,Location,-,-,-,-,"Combat does not occur on this battlefield. 
End of Phase: The player with the most creatures deployed to this battlefield captures it.",Brown
298,293.0,Battlefield,The Fog,State,-,-,-,-,"Revealed: Exhaust each creature.
End of Phase: Shuffle this battlefield back into it's owners battlefield deck.",Brown
299,294.0,Battlefield,The Trenches,Location,-,-,-,-,"When combat completes on The Trenches, creatures do not return to their owners Barracks. 
End of Phase: If player controls 2 more creatures on this battlefield than their opponent, they capture this battlefield.",Brown
300,295.0,Battlefield,"Variksylva, Dragon's Roost",Location | Wonder,-,-,-,-,Creatures with toughness or power less than 3 are considered to have an empty text box.,Brown
301,296.0,Battlefield,Waterlogged Cavern,Location,-,-,-,-,"Each time you deploy a creature, exhaust another ready friendly creature.",Brown
303,297.0,Artifact,Circlet of Translation,7A,Item,-,4,-,"Play: Your opponent discards a random card from their hand. Draw a card. 
Action: 2A. Discard a card in your hand. Draw a card.",Red
304,298.0,Artifact,Mark of the Successor,5A,Item | Wonder,-,6,-,"When an allied creature is destroyed, place a counter on ""Mark of the Successor."" 
Action: Play a card of cost equal to the total amount of tokens on this card at no cost. Sacrifice ""Mark of the Successor.""",Red
305,299.0,Artifact,Philosopher's Shard,6A,Item,-,5,-,"Play: Sacrifice an allied creature. Gain A mana equal to the cost of that creature until End of Phase.
Action: 2A. All the cards in your discard are considered A mana until End of Phase.",Red
306,300.0,Creature,"Var'i, Seer",4A,Human | Seer,1,1,1,Idle: Draw 2 cards. Discard 1,Red
307,301.0,Creature,Raspine Stowaway,1A,Beast,1,1,1,,Red
308,302.0,Creature,Bear Trap,2A,Construct,0,4,1,"Bear Trap enters play ready.
Trap: Deal 2 damage to the trapped creature and reduce its power to 0 until end of phase.",Red
309,303.0,Creature,"Idvaline, Chemical Genius",5A,Human | Scholar,3,3,1,"Subtle (This creature may ignore the battleline when deploying)
Creatures in the same zone as Idvaline lose Sturdy.
Deploy: Each creature in this zone takes damage equal to its restore stat.",Red
310,304.0,Creature,Cal,2A,Cyborg,0,1,1,Action: 4A. Destroy an enemy creature.,Red
311,305.0,Creature,Gas Pump,4A,Construct,0,2,1,"Gas Pump enter play ready.
Trap: Stockpile this card under the trapped creature. This creature gains ""End of Phase: This creature takes 2 damage.""",Red
312,306.0,Creature,Voice of the Oracle,3A,Apparition,1,3,3,"End of Phase: If a battlefield was captured this phase,  Look at the top three cards of your deck. Rearrange them in any order, then draw one.",Red
313,307.0,Creature,Rionate Mercenary,2A,Human,2,1,1,Destroyed: You may expend 1A to resummon Rionate Mercenary in your Barracks.,Red
314,308.0,Creature,"Ván, Magician",4A,Human | Thief,1,4,2,"Action: 1A. Reveal the top three cards of your deck. For each card of A color, shuffle a card from your enemy's discard into their deck. ",Red
315,309.0,Creature,"Binvi, The Embraced",5A,Kyr | [Trait],3,5,3,"Binvi recieves half damage (rounding down) from [Trait] creatures.
Deploy: Ready a friendly [Trait] creature.",Red
316,310.0,Creature,"Olian, The Wretched",8A,Kyr,6,3,0,"Sturdy.
Dauntless.
Olian, The Wretched does not take damage from [Trait] creatures.",Red
317,311.0,Creature,The Arbiter,2A,Kyr,2,2,1,"Trap: If the trapped creature is a Kyr, destroy it.",Red
318,312.0,Instant,Beat Down,3A,-,-,-,-,"Play: Deal 2 damage to a creature. If that creature already has damage on it, destroy it instead.",Red
319,313.0,Instant,Predict Future,3A,-,-,-,-,Play: Draw 3 cards. Discard 1,Red
320,314.0,Instant,Hard Read,1A,-,-,-,-,"Play: Your opponent reveals the top card of their library. If that card matches a card in play, draw 2 cards.",Red
