,ID,Type,Name,Cost,Traits,Strength,Health,Restore,Effect,Color
321,315.0,Instant,Entrench,3A,-,-,-,-,Play: Stockpile this under an allied creature. The creature this is stockpiled under gains Sentry and +0|+1|+0.,Red
322,316.0,Instant,Enlightened Counsel,3A,-,-,-,-,Play: Reveal from the top of your library until you find an artifact. Place that artifact in your hand and shuffle your library.,Red
323,317.0,Instant,Tribute,2A,-,-,-,-,"Play: Stockpile this card under a creature. That creature gains ""Destroyed: Your opponent gains 4A mana.""",Red
324,318.0,Instant,Overwhelming Force,5A,-,-,-,-,"Play: Exhaust two friendly creatures. If you do, destroy a creature.",Red
325,319.0,Instant,Weighted Bolas,2A,-,-,-,-,Play: Idle up to three enemy creatures.,Red
326,320.0,Instant,Divisive Manouver,2A,-,-,-,-,Play: Deploy or redeploy an enemy creature to a zone of your choosing. Exhaust that creature.,Red
327,321.0,Instant,Dying Breath,3A,-,-,-,-,"Play: Stockpile this card under an allied creature. The creature this card is stockpiled under gains ""Destroyed: place a creature in this zone on the bottom of its owners deck""",Red
328,322.0,Instant,Reinforce,2A,-,-,-,-,Play: Give a friendly artifact +2.,
329,323.0,Instant,Quick Thinking,3A,-,-,-,-,"Play: Stockpile this card under a creature.The creature this is stockpiled under gains ""Deploy: If this is the first time this creature has been deployed this turn, ready this creature.""",Red
330,324.0,Instant,Violence of the Learned,3A,-,-,-,-,"Play: Sacrifice a friendly artifact. If you do, search your library for any card you choose. Place that card in your hand and shuffle your library.",Red
331,325.0,Instant,Stacked Deck,2A,-,-,-,-,Play: Reveal the top five cards of your deck. You may place any number of these cards on the bottom of your deck.,Red
332,326.0,Instant,Grain of Knowledge,"4A
",-,-,-,-,Play: All the cards in your discard are considered A mana until End of Phase.,Red
